{
  "$schema":"https://json-schema.org/draft/2020-12/schema",
  "$id":"knowledge/tournament-of-triumph-faq-1330-core-four-fact-snapshot.schema.json",
  "type":"object","additionalProperties":false,
  "required":["snapshot_format","snapshot_id","source_id","source_url","retrieved_at","capture_policy","facts","non_claims"],
  "properties":{
    "snapshot_format":{"const":"fact_limited_official_support_snapshot_v1"},
    "snapshot_id":{"const":"tgc_faq_1330_tournament_of_triumph_core_four_2026_08_17"},
    "source_id":{"const":"source_tgc_faq_1330_tournament_of_triumph_core_four"},
    "source_url":{"const":"https://thatgamecompany.helpshift.com/hc/en/17-sky-children-of-the-light/faq/1330-patch-notes---july-2-2024---0-26-0-272243-android-huawei-ios-playstation-steam-272595-switch/"},
    "retrieved_at":{"type":"string","format":"date"},"capture_policy":{"type":"string","minLength":1},
    "facts":{"type":"object","additionalProperties":false,"required":["historical_window_start_date","historical_window_end_date","new_items"],"properties":{
      "historical_window_start_date":{"const":"2024-07-29"},"historical_window_end_date":{"const":"2024-08-18"},
      "new_items":{"const":[
        {"item_id":"item_tournament_of_triumph_curls","official_name_en":"Tournament Curls","original_currency":"event_currency","original_cost":25},
        {"item_id":"item_tournament_of_triumph_torch","official_name_en":"Tournament Torch","original_currency":"event_currency","original_cost":37},
        {"item_id":"item_tournament_of_triumph_golden_garland","official_name_en":"Tournament Golden Garland","original_currency":"USD","original_cost":4.99},
        {"item_id":"item_tournament_of_triumph_tunic","official_name_en":"Tournament Tunic","original_currency":"USD","original_cost":9.99}
      ]}
    }},
    "non_claims":{"type":"array","minItems":1,"items":{"type":"string","minLength":1}}
  }
}
